[
  {
    "explanation_type": "fast",
    "index": 0,
    "metadata": null,
    "prediction": {
      "classes": 1.0,
      "high": Infinity,
      "low": -Infinity,
      "predict": 1.3877787807814457e-17
    },
    "provenance": null,
    "rules": [
      {
        "bin_index": null,
        "feature": 0,
        "feature_value": null,
        "instance_prediction": null,
        "is_conjunctive": false,
        "rule": "x0",
        "rule_prediction": {
          "high": 2.9,
          "low": -1.9,
          "predict": 0.1
        },
        "rule_weight": {
          "high": 1.9,
          "low": -2.9,
          "predict": -0.09999999999999999
        },
        "value_str": "0.5"
      }
    ],
    "schema_version": "1.0.0",
    "task": "regression"
  },
  {
    "explanation_type": "fast",
    "index": 1,
    "metadata": null,
    "prediction": {
      "classes": 1.0,
      "high": Infinity,
      "low": -Infinity,
      "predict": 2.0
    },
    "provenance": null,
    "rules": [
      {
        "bin_index": null,
        "feature": 0,
        "feature_value": null,
        "instance_prediction": null,
        "is_conjunctive": false,
        "rule": "x0",
        "rule_prediction": {
          "high": 4.9,
          "low": 0.10000000000000009,
          "predict": 2.1
        },
        "rule_weight": {
          "high": 1.9,
          "low": -2.9000000000000004,
          "predict": -0.10000000000000009
        },
        "value_str": "2.5"
      }
    ],
    "schema_version": "1.0.0",
    "task": "regression"
  }
]