[
  {
    "explanation_type": "fast",
    "index": 0,
    "metadata": null,
    "prediction": {
      "__full_probabilities__": [
        [
          0.5,
          0.5
        ],
        [
          0.5,
          0.5
        ]
      ],
      "classes": 1.0,
      "high": 0.5384615384615384,
      "low": 0.46153846153846156,
      "predict": 0.5
    },
    "provenance": null,
    "rules": [],
    "schema_version": "1.0.0",
    "task": "classification"
  },
  {
    "explanation_type": "fast",
    "index": 1,
    "metadata": null,
    "prediction": {
      "__full_probabilities__": [
        [
          0.5,
          0.5
        ],
        [
          0.5,
          0.5
        ]
      ],
      "classes": 1.0,
      "high": 0.5384615384615384,
      "low": 0.46153846153846156,
      "predict": 0.5
    },
    "provenance": null,
    "rules": [],
    "schema_version": "1.0.0",
    "task": "classification"
  }
]