[
  {
    "explanation_type": "fast",
    "index": 0,
    "metadata": null,
    "prediction": {
      "__full_probabilities__": [
        [
          [
            0.5970149253731343,
            0.17910447761194032,
            0.22388059701492538
          ],
          [
            0.1739130434782609,
            0.1739130434782609,
            0.6521739130434782
          ]
        ],
        [
          0,
          2
        ]
      ],
      "classes": 0,
      "high": 0.8955223880597015,
      "low": 0.44776119402985076,
      "predict": 0.5970149253731343
    },
    "provenance": null,
    "rules": [
      {
        "bin_index": null,
        "feature": 0,
        "feature_value": null,
        "instance_prediction": null,
        "is_conjunctive": false,
        "rule": "f0",
        "rule_prediction": {
          "high": 0.9183673469387755,
          "low": 0.6122448979591837,
          "predict": 0.7346938775510204
        },
        "rule_weight": {
          "high": -0.015229972586049412,
          "low": -0.32135242156564126,
          "predict": -0.13767895217788617
        },
        "value_str": "0.1"
      },
      {
        "bin_index": null,
        "feature": 1,
        "feature_value": null,
        "instance_prediction": null,
        "is_conjunctive": false,
        "rule": "f1",
        "rule_prediction": {
          "high": 0.6585365853658536,
          "low": 0.43902439024390244,
          "predict": 0.548780487804878
        },
        "rule_weight": {
          "high": 0.15799053512923183,
          "low": -0.0615216599927193,
          "predict": 0.048234437568256294
        },
        "value_str": "0.0"
      }
    ],
    "schema_version": "1.0.0",
    "task": "classification"
  },
  {
    "explanation_type": "fast",
    "index": 1,
    "metadata": null,
    "prediction": {
      "__full_probabilities__": [
        [
          [
            0.5970149253731343,
            0.17910447761194032,
            0.22388059701492538
          ],
          [
            0.1739130434782609,
            0.1739130434782609,
            0.6521739130434782
          ]
        ],
        [
          0,
          2
        ]
      ],
      "classes": 2,
      "high": 0.8695652173913044,
      "low": 0.5797101449275363,
      "predict": 0.6521739130434782
    },
    "provenance": null,
    "rules": [
      {
        "bin_index": null,
        "feature": 0,
        "feature_value": null,
        "instance_prediction": null,
        "is_conjunctive": false,
        "rule": "f0",
        "rule_prediction": {
          "high": 0.7933194154488518,
          "low": 0.7211994685898652,
          "predict": 0.7272094641614475
        },
        "rule_weight": {
          "high": -0.06902555554638701,
          "low": -0.1411455024053736,
          "predict": -0.07503555111796933
        },
        "value_str": "1.5"
      },
      {
        "bin_index": null,
        "feature": 1,
        "feature_value": null,
        "instance_prediction": null,
        "is_conjunctive": false,
        "rule": "f1",
        "rule_prediction": {
          "high": 0.7091932457786115,
          "low": 0.6303939962476548,
          "predict": 0.6585365853658537
        },
        "rule_weight": {
          "high": 0.021779916795823362,
          "low": -0.05701933273513338,
          "predict": -0.006362672322375529
        },
        "value_str": "1.5"
      }
    ],
    "schema_version": "1.0.0",
    "task": "classification"
  }
]