[
  {
    "explanation_type": "fast",
    "index": 0,
    "metadata": null,
    "prediction": {
      "classes": 1.0,
      "high": Infinity,
      "low": -Infinity,
      "predict": 0.5
    },
    "provenance": null,
    "rules": [],
    "schema_version": "1.0.0",
    "task": "regression"
  },
  {
    "explanation_type": "fast",
    "index": 1,
    "metadata": null,
    "prediction": {
      "classes": 1.0,
      "high": Infinity,
      "low": -Infinity,
      "predict": 1.5
    },
    "provenance": null,
    "rules": [],
    "schema_version": "1.0.0",
    "task": "regression"
  }
]